{
  "schema_version": "omnia.openbsd_support.v1",
  "tier_set_id": "ob-tier-honesty-v1",
  "version": "1.0.0",
  "layer": "normative",
  "tier_ordering": {
    "order": [
      "UNKNOWN",
      "OPENBSD_BASE_AVAILABLE",
      "OPENBSD_PORT_AVAILABLE",
      "MOCK_TESTED",
      "VM_TESTED",
      "REAL_HOST_TESTED",
      "BERYL_TESTED"
    ],
    "promotion_requires_higher_or_equal": true
  },
  "promotion_forbidden": {
    "mock_must_not_claim_real_host": true,
    "mock_must_not_claim_beryl": true,
    "vm_must_not_claim_beryl": true,
    "real_host_must_not_claim_beryl_without_beryl_observation": true
  },
  "wireless_mediatek_status": {
    "wifi_success_must_be_observed_locally_before_claiming": true,
    "mediatek_success_must_be_observed_locally_before_claiming": true,
    "current_highest_claimable_without_observation": "UNKNOWN"
  },
  "claim_honesty_rules": {
    "no_kernel_modification_claim_unless_actually_patched_src": true,
    "no_real_host_claim_unless_observations_available": true,
    "no_production_mutation_claim_unless_boundary_observed": true
  },
  "last_verified": "2026-08-13",
  "notes": "Current state: bgpd/wg(4)/iked(8)/rpki-client OPENBSD_BASE_AVAILABLE, MOCK_TESTED via fixtures; REAL_HOST_TESTED / BERYL_TESTED UNKNOWN on all network adapters, Wi-Fi, MediaTek 7981/7988, and Beryl router images."
}
